idberita,kategori_berita,judul_berita,isi_berita
bmkg-wanti-wanti-potensi-banjir-rob-di-5-pesisir-di-pulau-bali-ini,Climate,BMKG Wanti-wanti Potensi Banjir Rob di 5 Pesisir di Pulau Bali Ini,"Bali, CNN Indonesia -- Badan Meteorologi, Klimatologi dan Geofisika (BMKG) mengungkap potensi banjir di pesisir atau rob di lima wilayah pesisir Pulau Bali yang diperkirakan terjadi pada tanggal 7-11 Oktober 2025. Kepala Balai Besar Meteorologi Klimatologi dan Geofisika (BBMKG) Wilayah III Denpasar Cahyo Nugroho mengatakan fenomena fase Perigee pada tanggal 7 Oktober 2025 dan bulan baru pada tanggal 7-11 Oktober 2025 berpotensi meningkatkan ketinggian air laut maksimum. Lihat Juga : Potensi Cuaca Ekstrem Awal Oktober, Hujan Lebat Ancam Deret Daerah Ini ADVERTISEMENT SCROLL TO CONTINUE WITH CONTENT ""Berdasarkan pantauan data water level dan prediksi pasang surut, banjir pesisir (rob) berpotensi terjadi di beberapa wilayah pesisir Bali,"" kata Cahyo, dalam keterangan tertulisnya, Rabu (1/10). Ia juga menyebutkan, potensi banjir pesisir ini berbeda waktu hari dan jam di setiap wilayah dan secara umum berdampak pada aktivitas masyarakat di sekitar pelabuhan dan pesisir, seperti aktivitas bongkar muat di pelabuhan, aktivitas di pemukiman pesisir, serta aktivitas tambak garam dan perikanan darat. ""Masyarakat dihimbau untuk selalu waspada dan siaga untuk mengantisipasi dampak dari pasang maksimum air laut serta memperhatikan update informasi cuaca maritim dari BMKG Wilayah III,"" ujarnya. Sementara, lima wilayah yang berpotensi rob diantaranya: 1.Pesisir Gianyar 2.Pesisir Kuta 3.Pesisir Tabanan 4.Pesisir Klungkung 5.Pesisir Karangasem Lihat Juga : Waspada Dampak Siklon Bualoi, Daerah-daerah Ini Potensi Hujan Ekstrem (kdf/dmi) [Gambas:Video CNN]"
makin-dekat-gaza-armada-bantuan-gsf-diteror-kapal-tak-dikenal,Eropa Amerika,"Makin Dekat Gaza, Armada Bantuan GSF 'Diteror' Kapal Tak Dikenal","Jakarta, CNN Indonesia -- Armada kapal Global Sumud Flotilla (GSF) yang membawa bantuan kemanusiaan ke Jalur Gaza mengatakan beberapa kapal tak dikenal mendekati armada mereka pada Rabu (1/10) dini hari. Dilansir Reuters , tidak jelas siapa yang mengoperasikan kapal-kapal yang mendekati armada tersebut. Di media sosial, pihak GSF menyebut sebuah kapal Israel mendekati kapal-kapal mereka dan melakukan ""manuver berbahaya"" serta mengacaukan sistem komunikasi. Lihat Juga : Kenapa Kapal Perang Italia Mundur Kawal Global Sumud Flotilla ke Gaza? ADVERTISEMENT SCROLL TO CONTINUE WITH CONTENT Pada sebuah foto terlihat siluet kapal militer dengan menara meriam di dekat kapal-kapal sipil GSF. ""Kami terus berlayar ke Gaza mendekati batas 120 mil laut, dekat area di mana armada sebelumnya telah dicegat atau diserang,"" demikian pernyataan GSF, dilaporkan Reuters. Israel belum mengomentari tuduhan tersebut, namun sebelumnya mengatakan akan melakukan segala cara untuk mencegah kapal-kapal GSF mendekati Gaza, dengan alasan bahwa blokade mereka sah karena sedang memerangi milisi Hamas. Lihat Juga : Demokrat vs Republik Saling Tuding soal Pemerintah AS Shutdown ""Teror"" kapal tak dikenal terjadi saat Italia menyatakan menarik mundur pengawalan kapal perang mereka atas GSF. Kementerian Pertahanan Italia mengatakan kapal fregat yang mengawal GSF dan saat ini berada di 278 kilometer dari garis pantai Gaza, memutuskan untuk berhenti. Italia menduga armada GSF bakal dicegat di laut lepas oleh Israel, dan para aktivis bakal ditangkap. Perdana Menteri Italia Giorgia Meloni lantas meminta armada itu untuk berhenti berlayar. Namun GSF menegaskan akan terus berlayar membawa bantuan kemanusiaan ke Gaza. Lihat Juga : Pemerintah AS Shutdown, Gedung Putih Salahkan Demokrat Armada GSF membawa lebih dari 500 relawan termasuk aktivis asal Swedia, Greta Thunberg. Kini, kapal mereka kian mendekati perairan Gaza. Menurut laporan armada tersebut bakal tiba di perairan Gaza dalam kurun waktu 18 jam. Publik khawatir mereka kembali menjadi target serangan Israel. (dna)"
saran-resepsionis-staycation-nyaman-di-hotel-ada-tips-saat-check-in,Travel,"Saran Resepsionis Staycation Nyaman di Hotel, Ada Tips Saat Check-In","Jakarta, CNN Indonesia -- Menginap di hotel bisa menjadi pengalaman yang menyenangkan dan berkesan. Asal, kamu tahu cara beradaptasi dengan aturan dan kebijakan yang berlaku di sana. Di sisi lain, pihak hotel juga berupaya memberikan pelayanan terbaik dan fasilitas memuaskan agar tamu merasa nyaman. Namun, ada beberapa hal yang sering kali membuat pihak hotel terganggu saat melayani tamu, yang sebenarnya bisa dihindari. Seorang resepsionis hotel sekaligus TikToker dengan akun @mamafromarkansas membagikan beberapa saran penting agar pengalaman menginap kamu bisa lebih nyaman. ADVERTISEMENT SCROLL TO CONTINUE WITH CONTENT Selain itu, ada juga tips praktis agar proses check-in hotel yang kamu lakukan bisa berjalan lancar tanpa hambatan. Menurut resepsionis tersebut, ada beberapa hal yang sebaiknya tidak dilakukan saat menginap di hotel agar tidak menyulitkan staf dan menjaga kenyamanan bersama. Pilihan Redaksi Hotel Tertinggi Dunia Dibuka 2 Bulan Lagi, Tarifnya Mulai Rp9,6 Juta Cara Pramugari Pakai Ponsel Deteksi Kamera Tersembunyi di Kamar Hotel Hotel Ini Jamin Cuaca Cerah, Tamu Menginap Gratis jika Turun Hujan ""Saya bekerja sebagai resepsionis di sebuah hotel dan saya akan membacakan daftar hal-hal yang tidak boleh Anda lakukan sebagai seseorang yang akan berkunjung ke sebuah hotel,"" katanya dalam video di akun TikTok @mamafromarkansas, seperti dilansir Mirror . ""Seseorang harus memberi tahu kalian bagaimana seharusnya bersikap,"" ujar wanita itu lagi. Berikut beberapa poin penting yang perlu diperhatikan saat menginap di hotel: 1. Jangan terlambat check-in Salah satu hal yang paling mengganggu, yaitu tamu datang terlambat saat melakukan check-in hotel. Apalagi kalau terlambat sampai satu hari dan berharap kamar masih tersedia. Jika tamu tidak melakukan check-in tepat waktu, biasanya pemesanan akan dibatalkan dan kamar tersebut akan ditawarkan ke tamu lain. Oleh karena itu, usahakan datang tepat waktu sesuai jadwal pemesanan agar tidak kehilangan kamar yang sudah kamu pesan. 2. Reservasi langsung ke hotel Membuat reservasi langsung ke pihak hotel lebih disarankan dibandingkan melalui situs pemesanan pihak ketiga. Pemesanan lewat pihak ketiga sering menimbulkan masalah. ""Yang akan terjadi adalah reservasi Anda akan hilang; Anda perlu pengembalian uang; Anda perlu membatalkan. Sesuatu akan terjadi dan kami tidak dapat mengubah reservasi itu karena Anda memesan melalui pihak ketiga,"" ujarnya. Dengan memesan langsung, kamu bisa berkomunikasi langsung dengan hotel dan mengurangi risiko kesalahan pemesanan. 3. Jaga sopan santun Sopan santun sangat penting saat menginap di hotel. Ingatlah bahwa staf hotel hanya menjalankan tugas mereka untuk memberikan pelayanan terbaik. Hindari marah atau bersikap kasar kepada karyawan. Hal ini tidak akan menyelesaikan masalah dan justru membuat suasana menjadi tidak nyaman. Selain mengikuti saran di atas, ada beberapa tips tambahan agar proses check-in hotel kamu berjalan mulus dan bebas stres: 1. Perhatikan waktu check-in Hindari memulai perjalanan pada hari Jumat, karena biasanya hari itu adalah hari paling sibuk untuk kedatangan tamu hotel. Hari Senin dan Selasa juga cenderung ramai karena banyak yang melakukan perjalanan bisnis. Kalau memungkinkan, pilih waktu check-in di tengah minggu agar antrean lebih singkat. Andaikan kamu harus datang pada hari sibuk, usahakan meminta waktu check-in lebih awal saat memesan kamar agar bisa melewati keramaian. 2. Lakukan double-check pemesanan Pastikan kamu sudah memasukkan detail pemesanan dengan benar, termasuk tipe kamar, kebutuhan khusus, seperti aksesibilitas dan preferensi lantai kamar. Misalnya, kalau kamu mudah terbangun, mintalah kamar yang jauh dari lift atau area ramai agar tidak terganggu suara. Kalau membawa hewan peliharaan, pastikan hotel menerima tamu dengan hewan dan ketahui fasilitas yang tersedia. 3. Telepon hotel sebelum datang Untuk menghindari kejadian buruk seperti tidak adanya kamar yang sudah kamu pesan, sebaiknya hubungi hotel satu atau dua hari sebelum kedatangan untuk konfirmasi reservasi. Pastikan nama dan informasi detail lainnya sudah benar. Siapkan pula dokumen identitas yang diperlukan saat check-in. 4. Berikan informasi kontak saat check-in Tips dari Travel+Leisure , Saat melakukan check-in hotel, jangan lupa berikan alamat email atau nomor telepon kepada resepsionis. Dengan begitu, kamu bisa menerima tagihan atau informasi penting lainnya secara elektronik setelah check-out. 5. Minta upgrade kamar dengan sopan Kalau kamu ingin mendapat kamar yang lebih baik, jangan ragu untuk bertanya dengan sopan saat check-in. Biasanya, terutama saat low season , pihak hotel memiliki kamar premium yang belum terisi dan bisa diberikan sebagai upgrade gratis. Sikap ramah dan sopan sangat membantu agar permintaanmu dipertimbangkan pihak hotel. Dengan mengikuti saran dari resepsionis dan menerapkan tips di atas, kamu bisa menikmati pengalaman menginap yang lebih nyaman dan lancar. Proses check-in hotel yang mulus juga akan membuat perjalananmu lebih menyenangkan tanpa harus menghadapi stres atau masalah yang tidak perlu. Tips agar Proses Check-in Hotel Lancar BACA HALAMAN BERIKUTNYA HALAMAN: 1 2"
bos-bgn-buka-suara-soal-wartawan-dicekik-saat-liput-dapur-mbg,Bisnis,Bos BGN Buka Suara soal Wartawan Dicekik Saat Liput Dapur MBG,"Jakarta, CNN Indonesia -- Kepala Badan Gizi Nasional ( BGN ) Dadan Hindayana merespons kabar wartawan dianiaya saat meliput Makan Bergizi Gratis ( MBG ). Ia mengatakan belum mendapatkan konfirmasi soal itu. Dadan berjanji akan mengecek kebenaran kabar itu. ""Tapi kami minta maaf ya kalau petugas kami melakukan itu, tapi kami tetap sedang klarifikasi kejadian yang sebenarnya. Apa pun bentuknya kekerasan, tidak boleh,"" ujar Dadan di Istana Kepresidenan, Jakarta, Rabu (2/10). ADVERTISEMENT SCROLL TO CONTINUE WITH CONTENT Dadan menegaskan ia sama sekali tidak pernah melarang wartawan meliput MBG. Ia mengaku mempersilahkan sejumlah wartawan yang menghubungi untuk meminta izin meliput MBG. Lihat Juga : Purbaya Tak Terima Diadukan ke DPR oleh BUMN: Saya Bukan Juru Bayar! Meski demikian, ia meminta wartawan untuk memberi tahu BGN terlebih dulu sebelum meliput MBG. ""Karena itu kan terkait dengan aspek higienis itu. Jadi kalau tiba-tiba masuk, meliput, tidak menggunakan APD kan menyalahi prosedur. Jadi kalau menyampaikan dulu pemberitahuan, minta izin, pasti kami persilakan untuk meliput,"" kata Dadan. Sebelumnya, seorang wartawan media Warta Kota bernama Munir menjadi korban penganiayaan orang tak dikenal saat meliput lokasi Satuan Pelayanan Pemenuhan Gizi (SPPG). Munir bercerita mendatangi SPPG Gedong 2, dekat Kampus Unindra. Ia mendatangi lokasi itu untuk melakukan tindak lanjut kasus keracunan MBG yang dialami 20 siswa SDN 01 Gedong, Pasar Rebo, Jakarta Timur. Munir dan kawannya sempat masuk ke dapur SPPG karena seorang pria mengiranya tukang ompreng. Setelah mengetahui Munir dan kawannya hendak meliput, pria itu melakukan pengusiran. Dua orang itu keluar lokasi sambil mengambil gambar pria yang marah-marah. Mereka lalu berhenti setelah ada mobil SPPG datang. Seorang pegawai SPPG mengarahkan Munir dan kawannya ke SPPG lain yang berlokasi di dekat lokasi itu. Munir dan Kiki pun langsung berencana menuju ke SPPG Gedong 1. Namun, tiba-tiba pelaku langsung mendatangi Munir dan mencekik. ""Tiba-tiba bapak yang tadi sudah kepalkan tangannya mau pukul saya, terus tiba-tiba malah cekik saya dan Kiki. Pegawai SPPG lain langsung memisahkan dan si bapak keamanan tadi dipegangin oleh rekan-rekannya,"" kata dia. Kapolsek Pasar Rebo AKP I Wayan Wijaya mengatakan sudah menerima laporan penganiayaan wartawan akibat meliput MBG. Sebelumnya, sebanyak 20 siswa SDN 01 Gedong Jalan Trikora, Kelurahan Gedong, Pasar Rebo, Jakarta Timur diduga keracunan MBG, Selasa (30/9). Wayan mengatakan peristiwa bermula saat sekolah itu menerima kiriman MBG sekitar pukul 06.00 WIB. [Gambas:Video CNN] (tfq, fby/dhf)"
puluhan-siswa-smp-di-banjar-jabar-keracunan-mbg,Peristiwa,Puluhan Siswa SMP di Banjar Jabar Keracunan MBG,"Bandung, CNN Indonesia -- Puluhan siswa SMP Negeri 3 Banjar, Jawa Barat mengalami keracunan usai menyantap makan bergizi gratis (MBG), Rabu (1/10). Saat ini beberapa siswa dilarikan ke rumah sakit untuk mendapatkan penanganan. Salah satu guru SMPN 3, Nuryana mengatakan terdapat 856 siswa yang menerima MBG pada hari ini. Pembagian hidangan MBG dilakukan sekitar pukul 11.30 WIB atau saat jam istirahat. Lihat Juga : BPOM: 314 Siswa Sulteng Keracunan Tuna MBG Akibat Kadar Histamin ADVERTISEMENT SCROLL TO CONTINUE WITH CONTENT Menurut Nuryana, setelah memakan hidangan MBG, sekitar 15 menit kemudian, para siswa mengalami berbagai gejala keracunan seperti mual, sesak, dan pusing. ""Reaksinya sekitar 15 menit. Gejalanya pusing mual dan sesak,"" kata Nuryana saat dikonfirmasi CNNIndonesia.com . Nuryana menyebut pasokan MBG diberikan dari dapur SPPG yang ada di Jalan Mesjid Agung. Lokasi SPPG tidak jauh dari SMPN 3 Banjar. Menurutnya, beberapa guru sempat mencicipi menu yang diberikan dari dapur. Namun, muncul bau tak sedap dari beberapa hidangan MBG. ""Ada yang bau ada yang enggak. Yang bau ya enggak dikasihkan,"" katanya. Lihat Juga : DPR Sentil Kepala BGN: Korban Keracunan MBG Bukan Statistik Semata Nuryana mengatakan beberapa siswa telah mendapat penanganan medis dengan diberikan obat dan infus. Kemudian sebagian juga ada yang dipasangkan selang oksigen, untuk membantu pernafasan. ""Total sih kurang tahu. Kemungkinan ada segitu (68 siswa), yang sama saya di PMC hanya 25 siswa. Tapi itu pun sebagian sudah pulang,"" kata dia. Nuryana menyebut menu MBG yang diberikan kepada para siswa, yakni ayam suwir, buah anggur hijau, tempe goreng dan nasi. Tidak ada susu dalam menu yang diberikan. ""Para siswa ada yang dirujuk ke PMC yang sama saya, kemudian ke RSUD Banjar, dan Mitra Idaman,"" ujarnya. (fra/csr/fra) [Gambas:Video CNN]"
sinopsis-transporter-3-bioskop-trans-tv-1-oktober-2025,Film,"Sinopsis Transporter 3, Bioskop Trans TV 1 Oktober 2025","Jakarta, CNN Indonesia -- Bioskop Trans TV malam ini, Rabu 1 Oktober 2025, akan menayangkan film Transporter 3 (2008) pada pukul 21.00 WIB. Berikut sinopsis Transporter 3 dibintangi Jason Statham, Natalya Rudakova dan François Berléand. Menjadi sekuel terakhir dari trilogi Transporter, sinopsis Transporter 3 mengisahkan Frank Martin (Jason Statham) menuju French Riviera setelah gagal memancing dengan temannya, Inspektur Tarconi (François Berléand) di Miami. Lihat Juga : Penjelasan Identitas Kartu Joker di Alice in Borderland 3 ADVERTISEMENT SCROLL TO CONTINUE WITH CONTENT Di saat bersamaan, Tarconi justru menerima kasus baru, melibatkan sebuah mobil Audi A8 yang telah melewati batas bea cukai Prancis. Karena kasus tersebut, Tarconi akhirnya memutuskan kembali ke markas. Ia memberi tahu Frank bahwa Menteri Lingkungan Hidup Ukraina Leonid Tomilenko (Jeroen Krabbé) menerima ancaman berbahaya dari bos perusahaan Ecocorp, Johnson (Robert Knepper). Pada malam harinya, sebuah mobil Audi menabrak rumah Frank hingga melukai sang sopir, Malcolm Melville (David Atrakchi). Frank sontak mengenali sosok Malcolm karena merupakan rekanan lamanya. [Gambas:Video CNN] Saat paramedis datang untuk menolong Malcolm, Frank mendapati seorang wanita di kursi penumpang yang bernama Valentina Tomilenko (Natalya Rudakova). Valentina kemudian menegaskan kepada Frank untuk tidak membawanya keluar mobil. Ia memperingatkan Frank dirinya sedang mengenakan gelang logam yang merupakan peledak. Jika Valentina berada jauh dari mobil, gelang itu akan meledak. Pilihan Redaksi 5 Rekomendasi Drama Korea Terpopuler September 2025 Film Asing ke AS Terancam Dipalak Tarif 100% oleh Donald Trump Sehingga, Frank bergegas mencari Malcolm yang telah dibawa oleh para medis. Namun saat ia baru keluar, ambulans tersebut meledak. Tak lama kemudian, Johnson mendadak muncul dan menempatkan gelang peledak pada tangan Frank. Transporter 3 merupakan bagian ketiga dan terakhir dalam trilogi Transporter. Film ini disutradarai oleh Olivier Megaton yang juga mengarahkan film pertama. Saat ditayangkan pada 2008, film ini meraup lebih dari US$109 juta dari penayangan global dan menjadikan film ini sebagai film dengan pendapatan tertinggi dari trilogi Transporter. Setelah mengetahui sinopsis Transporter 3, saksikan film tersebut di Bioskop Trans TV pukul 21.00 WIB. Bioskop Trans TV juga akan menayangkan The Protégé (2021) pukul 23.00 WIB. [Gambas:Youtube] (chri)"
bpom-314-siswa-sulteng-keracunan-tuna-mbg-akibat-kadar-histamin,Peristiwa,BPOM: 314 Siswa Sulteng Keracunan Tuna MBG Akibat Kadar Histamin,"Jakarta, CNN Indonesia -- Balai Pengawas Obat dan Makanan ( BPOM ) Palu memastikan penyebab terjadinya keracunan makanan dari program makan bergizi gratis (MBG) terhadap 314 siswa SD, SMP hingga SMA di Kabupaten Banggai, Sulawesi Tengah, akibat kadar histamin Ratusan siswa tersebut dilarikan ke rumah sakit setelah mengalami mual, muntah, sakit perut dan pusing serta sesak nafas usai menyantap menu makanan dari MBG berupa ikan tuna goreng saus. Lihat Juga : Menkes Ungkap Sebab Keracunan MBG: E Coli hingga Virus Hepatitis A ADVERTISEMENT SCROLL TO CONTINUE WITH CONTENT ""Hasil uji kami itu temukan memang ada kadar histamin, terutama pada ikan tuna dan sejenisnya,"" kata Kepala BPOM Palu, Mardianto kepada wartawan, Selasa (1/10). Mardianto menuturkan bahwa pihaknya juga menemukan sejumlah parameter yang tidak memenuhi syarat, baik dari sisi kimia maupun mikrobiologi. ""Pangan yang dicurigai sebagai penyebab sudah diamankan dan dipastikan tidak boleh lagi dikonsumsi,"" ungkapnya. Lihat Juga : 56 Dapur MBG Dinonaktifkan Imbas Kasus Keracunan Meski demikian, kata Mardianto, pihak Dinas Kesehatan yang berwenang untuk menentukan penyebab keracunan tersebut. Sedangkan, pihaknya hanya melakukan pemeriksaan sampel makanan berdasarkan ada permintaan. ""Hasilnya kami sampaikan kepada pemohon. Nanti mereka yang menetapkan penyebabnya, apakah karena faktor kimia atau mikro,"" katanya. Lihat Juga : Farhan Hamid Masih Hilang Usai Gelombang Demo di Jakarta Akhir Agustus (mir/kid) [Gambas:Video CNN]"
video-pemerintahan-as-shutdown-apa-dampaknya,Eropa Amerika,"VIDEO: Pemerintahan AS Shutdown, Apa Dampaknya?","Jakarta, CNN Indonesia -- Pemerintah Amerika Serikat resmi shutdown setelah Senat gagal menyetujui anggaran belanja tahunan pada Selasa (30/9) malam. Pemungutan suara di Senat berakhir dengan suara 55-45 atau kurang dari 60 suara yang dibutuhkan untuk meloloskan rancangan undang-undang (RUU) pendanaan. Kebuntuan anggaran ini terjadi setelah Partai Demokrat bersikeras agar subsidi layanan kesehatan diperpanjang di bawah Undang-Undang Perawatan Terjangkau (Affordable Care Act/ACA). Pasalnya, dalam RUU anggaran yang dibahas, subsidi kesehatan ACA ini akan kedaluwarsa. Partai Republik menolak permintaan Demokrat karena ingin RUU anggaran bersih tanpa tambahan persyaratan. Kebuntuan ini pun semakin diperkeruh oleh pernyataan Presiden Donald Trump menjelang pemungutan suara. Trump mengancam akan membatalkan program-program dukungan Partai Demokrat serta memecat pegawai-pegawai federal jika pemerintah mengalami shutdown."
kpk-ungkap-alasan-tak-pakai-pasal-suap-di-kasus-kuota-haji,Hukum Kriminal,KPK Ungkap Alasan Tak Pakai Pasal Suap di Kasus Kuota Haji,"Jakarta, CNN Indonesia -- Komisi Pemberantasan Korupsi (KPK) mengungkap alasan tidak menggunakan pasal suap dalam kasus dugaan korupsi kuota haji tambahan untuk penyelenggaraan ibadah haji tahun 2024. Dalam kasus itu, KPK menggunakan pasal terkait kerugian keuangan negara. Pelaksana Tugas Deputi Penindakan dan Eksekusi KPK Asep Guntur Rahayu mengatakan suap cenderung lebih mudah dan hanya berhenti pada proses hukum terhadap penerima dan pemberinya saja, tetapi tidak ada perubahan dari sistem. ""Misalkan si A ingin mendapatkan kuota, si B lalu memberikan kuota yang seharusnya bukan untuk si A. Nah, kemudian si A memberikan sesuatu atau sejumlah uang kepada si B sebagai kompensasi atas diberikannya kuota yang bukan miliknya. Hanya sampai di situ,"" ujar Asep di Kantornya, Jakarta, Rabu (1/10). ADVERTISEMENT SCROLL TO CONTINUE WITH CONTENT ""Selesai kita membuktikan sebuah tindak pidana, si A kemudian kita bawa dan si B kita ajukan ke pengadilan untuk diadili. Hanya selesai di situ,"" sambungnya. Lihat Juga : KPK Tahan Eks Dirut PGN Terkait Kasus Jual Beli Gas Sementara untuk Pasal 2 ayat 1 atau Pasal 3 Undang-undang Pemberantasan Tindak Pidana Korupsi (UU Tipikor) yang mengatur tentang kerugian keuangan negara, selain memproses hukum pihak yang melanggar hukum, KPK bisa memperbaiki sebuah sistem agar tak bisa dimainkan lagi ke depan. ""Jadi, keuntungannya adalah kita mengetahui siapa yang melakukan perbuatan melawan hukumnya. Kedua, bagaimana sistem dari pelaksanaan atau penyelenggaraan haji ini sehingga kenapa bisa terjadi kebocoran. Itu dari sisi penindakannya yang dilakukan,"" tutur Asep. ""Dilakukan evaluasi dan nanti hasil evaluasinya akan kita sampaikan kepada Kementerian Haji. Titik-titik mana saja kah yang merupakan titik rawan terjadinya mungkin tempat-tempat kebocoran anggaran tersebut sehingga dalam pelaksanaan haji di tahun berikutnya, misalkan tahun 2026 dan seterusnya, kebocoran-kebocoran itu bisa diantisipasi,"" tandasnya. KPK masih membutuhkan waktu untuk menuntaskan penanganan kasus ini. Sebab, kuota haji tambahan melibatkan 400-an travel dan uang sudah mengalir ke banyak pihak. KPK juga masih mengejar pihak yang berperan sebagai juru simpan uang diduga hasil korupsi kuota haji tambahan. KPK bekerja sama dengan Pusat Pelaporan dan Analisis Transaksi Keuangan (PPATK) dalam menelusuri aliran uang dalam kasus ini. Lihat Juga : Total 25 Mobil & 7 Motor Kasus Noel Ebenezer Masuk Gedung Rampasan KPK Berdasarkan perhitungan awal KPK, ditemukan kerugian negara dalam kasus dugaan korupsi kuota haji tambahan tahun 2023-2024 mencapai Rp1 triliun lebih. Temuan ini akan dikoordinasikan lebih lanjut dengan Badan Pemeriksa Keuangan (BPK). Hingga saat ini KPK masih menunggu perhitungan final mengenai kerugian keuangan negara dari BPK. KPK sudah mencegah tiga orang untuk bepergian ke luar negeri selama enam bulan. Mereka ialah mantan Menteri Agama Yaqut Cholil Qoumas, staf khususnya Ishfah Abidal Aziz, dan pemilik agen perjalanan Maktour Travel, Fuad Hasan Masyhur. KPK juga sudah menggeledah sejumlah tempat seperti rumah kediaman Yaqut di Condet, Jakarta Timur, kantor agen perjalanan haji dan umrah di Jakarta, rumah ASN Kementerian Agama di Depok, hingga ruang Direktorat Jenderal Penyelenggaraan Haji dan Umrah (PHU) Kementerian Agama. Banyak barang bukti diduga terkait perkara telah disita. Di antaranya dokumen, Barang Bukti Elektronik (BBE), hingga kendaraan roda empat dan properti. (fra/ryn/fra) [Gambas:Video CNN]"
